<?xml version="1.0" encoding="UTF-8"?>
<users xmlns:xsi="http://www.w3.org/2001/XMLSchema-instance" xsi:noNamespaceSchemaLocation="xsd/Users.xsd">
	<user id="1">
		<first-name>admin</first-name>
		<last-name>admin</last-name>
		<role>ADMINISTRATOR</role>
		<email>admin</email>
		<password>admin</password>
	</user>
	<user id="2">
		<first-name>user</first-name>
		<last-name>user</last-name>
		<role>USER</role>
		<email>user</email>
		<password>user</password>
	</user>
</users>